A1: Name | B1: School | C1: Total Tossups | D1: Total Interrupts | E1: PPG | F1: T / I | G1: Round 1 | I1: Round 2 | K1: Round 3 | M1: Round 4 | O1: Round 5 | Q1: Round 6 | S1: Round 7 | U1: Round 8 | W1: Round 9 | Y1: Total Points | Z1: Games Played
G2: Toss | H2: Int | I2: Toss | J2: Int | K2: Toss | L2: Int | M2: Toss | N2: Int | O2: Toss | P2: Int | Q2: Toss | R2: Int | S2: Toss | T2: Int | U2: Toss | V2: Int | W2: Toss | X2: Int
A3: Alan Florence | B3: Edmonson A | C3: =G3+I3+K3+M3+O3+Q3+S3+U3+W3 -> 52 | D3: =H3+J3+L3+N3+P3+R3+T3+V3+X3 -> 16 | E3: =IF(Z3=0,0,Y3/Z3) -> 55 | F3: =IF(D3=0,"***",C3/D3) -> 3.25 | G3: 7 | H3: 5 | I3: 7 | J3: 2 | K3: 11 | L3: 0 | M3: 5 | N3: 1 | O3: 3 | P3: 5 | Q3: 5 | R3: 1 | S3: 8 | T3: 1 | U3: 6 | V3: 1 | Y3: =10*C3-5*D3 -> 440 | Z3: =IF(G3="",0,1)+IF(I3="",0,1)+IF(K3="",0,1)+IF(M3="",0,1)+IF(O3="",0,1)+IF(Q3="",0,1)+IF(S3="",0,1)+IF(U3="",0,1)+IF(W3="",0,1) -> 8
A4: Chris Martin | B4: Apollo | C4: =G4+I4+K4+M4+O4+Q4+S4+U4+W4 -> 38 | D4: =H4+J4+L4+N4+P4+R4+T4+V4+X4 -> 9 | E4: =IF(Z4=0,0,Y4/Z4) -> 41.875 | F4: =IF(D4=0,"***",C4/D4) -> 4.2222222222222223 | G4: 4 | H4: 2 | I4: 5 | J4: 0 | K4: 7 | L4: 0 | M4: 3 | N4: 0 | O4: 3 | P4: 1 | S4: 3 | T4: 3 | U4: 5 | V4: 1 | W4: 8 | X4: 2 | Y4: =10*C4-5*D4 -> 335 | Z4: =IF(G4="",0,1)+IF(I4="",0,1)+IF(K4="",0,1)+IF(M4="",0,1)+IF(O4="",0,1)+IF(Q4="",0,1)+IF(S4="",0,1)+IF(U4="",0,1)+IF(W4="",0,1) -> 8
A5: Patrick Maginnis | B5: St. Xavier A | C5: =G5+I5+K5+M5+O5+Q5+S5+U5+W5 -> 32 | D5: =H5+J5+L5+N5+P5+R5+T5+V5+X5 -> 4 | E5: =IF(Z5=0,0,Y5/Z5) -> 37.5 | F5: =IF(D5=0,"***",C5/D5) -> 8.00 | G5: 3 | H5: 0 | I5: 8 | J5: 0 | M5: 4 | N5: 0 | O5: 4 | P5: 1 | Q5: 3 | R5: 2 | S5: 5 | T5: 0 | U5: 4 | V5: 1 | W5: 1 | X5: 0 | Y5: =10*C5-5*D5 -> 300 | Z5: =IF(G5="",0,1)+IF(I5="",0,1)+IF(K5="",0,1)+IF(M5="",0,1)+IF(O5="",0,1)+IF(Q5="",0,1)+IF(S5="",0,1)+IF(U5="",0,1)+IF(W5="",0,1) -> 8
A6: Darsh Ranjan | B6: Dunbar B | C6: =G6+I6+K6+M6+O6+Q6+S6+U6+W6 -> 32 | D6: =H6+J6+L6+N6+P6+R6+T6+V6+X6 -> 5 | E6: =IF(Z6=0,0,Y6/Z6) -> 36.875 | F6: =IF(D6=0,"***",C6/D6) -> 6.40 | G6: 6 | H6: 1 | I6: 2 | J6: 0 | K6: 3 | L6: 1 | M6: 5 | N6: 0 | O6: 4 | P6: 0 | Q6: 4 | R6: 1 | S6: 2 | T6: 1 | W6: 6 | X6: 1 | Y6: =10*C6-5*D6 -> 295 | Z6: =IF(G6="",0,1)+IF(I6="",0,1)+IF(K6="",0,1)+IF(M6="",0,1)+IF(O6="",0,1)+IF(Q6="",0,1)+IF(S6="",0,1)+IF(U6="",0,1)+IF(W6="",0,1) -> 8
A7: Kyle Housley | B7: GRC B | C7: =G7+I7+K7+M7+O7+Q7+S7+U7+W7 -> 27 | D7: =H7+J7+L7+N7+P7+R7+T7+V7+X7 -> 5 | E7: =IF(Z7=0,0,Y7/Z7) -> 30.625 | F7: =IF(D7=0,"***",C7/D7) -> 5.40 | G7: 2 | H7: 1 | I7: 5 | J7: 0 | K7: 2 | L7: 0 | O7: 2 | P7: 0 | Q7: 5 | R7: 0 | S7: 5 | T7: 2 | U7: 3 | V7: 0 | W7: 3 | X7: 2 | Y7: =10*C7-5*D7 -> 245 | Z7: =IF(G7="",0,1)+IF(I7="",0,1)+IF(K7="",0,1)+IF(M7="",0,1)+IF(O7="",0,1)+IF(Q7="",0,1)+IF(S7="",0,1)+IF(U7="",0,1)+IF(W7="",0,1) -> 8
A8: Garrett Schmitt | B8: Apollo | C8: =G8+I8+K8+M8+O8+Q8+S8+U8+W8 -> 28 | D8: =H8+J8+L8+N8+P8+R8+T8+V8+X8 -> 8 | E8: =IF(Z8=0,0,Y8/Z8) -> 30 | F8: =IF(D8=0,"***",C8/D8) -> 3.50 | G8: 6 | H8: 0 | I8: 5 | J8: 2 | K8: 3 | L8: 1 | M8: 3 | N8: 0 | O8: 5 | P8: 2 | S8: 3 | T8: 1 | U8: 1 | V8: 2 | W8: 2 | X8: 0 | Y8: =10*C8-5*D8 -> 240 | Z8: =IF(G8="",0,1)+IF(I8="",0,1)+IF(K8="",0,1)+IF(M8="",0,1)+IF(O8="",0,1)+IF(Q8="",0,1)+IF(S8="",0,1)+IF(U8="",0,1)+IF(W8="",0,1) -> 8
A9: Elliott Fleming | B9: Dunbar A | C9: =G9+I9+K9+M9+O9+Q9+S9+U9+W9 -> 33 | D9: =H9+J9+L9+N9+P9+R9+T9+V9+X9 -> 19 | E9: =IF(Z9=0,0,Y9/Z9) -> 29.375 | F9: =IF(D9=0,"***",C9/D9) -> 1.736842105263158 | I9: 1 | J9: 1 | K9: 3 | L9: 2 | M9: 6 | N9: 3 | O9: 5 | P9: 5 | Q9: 4 | R9: 3 | S9: 4 | T9: 3 | U9: 4 | V9: 1 | W9: 6 | X9: 1 | Y9: =10*C9-5*D9 -> 235 | Z9: =IF(G9="",0,1)+IF(I9="",0,1)+IF(K9="",0,1)+IF(M9="",0,1)+IF(O9="",0,1)+IF(Q9="",0,1)+IF(S9="",0,1)+IF(U9="",0,1)+IF(W9="",0,1) -> 8
A10: Diane Roller | B10: GRC A | C10: =G10+I10+K10+M10+O10+Q10+S10+U10+W10 -> 25 | D10: =H10+J10+L10+N10+P10+R10+T10+V10+X10 -> 3 | E10: =IF(Z10=0,0,Y10/Z10) -> 29.375 | F10: =IF(D10=0,"***",C10/D10) -> 8.3333333333333339 | G10: 5 | H10: 0 | K10: 5 | L10: 0 | M10: 0 | N10: 0 | O10: 2 | P10: 1 | Q10: 1 | R10: 0 | S10: 1 | T10: 1 | U10: 4 | V10: 1 | W10: 7 | X10: 0 | Y10: =10*C10-5*D10 -> 235 | Z10: =IF(G10="",0,1)+IF(I10="",0,1)+IF(K10="",0,1)+IF(M10="",0,1)+IF(O10="",0,1)+IF(Q10="",0,1)+IF(S10="",0,1)+IF(U10="",0,1)+IF(W10="",0,1) -> 8
A11: Darra Clark | B11: Dunbar B | C11: =G11+I11+K11+M11+O11+Q11+S11+U11+W11 -> 22 | D11: =H11+J11+L11+N11+P11+R11+T11+V11+X11 -> 3 | E11: =IF(Z11=0,0,Y11/Z11) -> 25.625 | F11: =IF(D11=0,"***",C11/D11) -> 7.333333333333333 | G11: 2 | H11: 0 | I11: 2 | J11: 0 | K11: 5 | L11: 1 | M11: 1 | N11: 0 | O11: 5 | P11: 1 | Q11: 1 | R11: 0 | S11: 1 | T11: 1 | W11: 5 | X11: 0 | Y11: =10*C11-5*D11 -> 205 | Z11: =IF(G11="",0,1)+IF(I11="",0,1)+IF(K11="",0,1)+IF(M11="",0,1)+IF(O11="",0,1)+IF(Q11="",0,1)+IF(S11="",0,1)+IF(U11="",0,1)+IF(W11="",0,1) -> 8
A12: Kartik Venguswamy | B12: Dunbar A | C12: =G12+I12+K12+M12+O12+Q12+S12+U12+W12 -> 25 | D12: =H12+J12+L12+N12+P12+R12+T12+V12+X12 -> 11 | E12: =IF(Z12=0,0,Y12/Z12) -> 24.375 | F12: =IF(D12=0,"***",C12/D12) -> 2.2727272727272729 | I12: 3 | J12: 2 | K12: 2 | L12: 1 | M12: 3 | N12: 1 | O12: 3 | P12: 2 | Q12: 3 | R12: 2 | S12: 3 | T12: 1 | U12: 3 | V12: 1 | W12: 5 | X12: 1 | Y12: =10*C12-5*D12 -> 195 | Z12: =IF(G12="",0,1)+IF(I12="",0,1)+IF(K12="",0,1)+IF(M12="",0,1)+IF(O12="",0,1)+IF(Q12="",0,1)+IF(S12="",0,1)+IF(U12="",0,1)+IF(W12="",0,1) -> 8
A13: Mathew Andreas | B13: GRC A | C13: =G13+I13+K13+M13+O13+Q13+S13+U13+W13 -> 22 | D13: =H13+J13+L13+N13+P13+R13+T13+V13+X13 -> 5 | E13: =IF(Z13=0,0,Y13/Z13) -> 24.375 | F13: =IF(D13=0,"***",C13/D13) -> 4.40 | G13: 2 | H13: 1 | K13: 2 | L13: 0 | M13: 4 | N13: 1 | O13: 2 | P13: 1 | Q13: 6 | R13: 1 | S13: 3 | T13: 0 | U13: 1 | V13: 1 | W13: 2 | X13: 0 | Y13: =10*C13-5*D13 -> 195 | Z13: =IF(G13="",0,1)+IF(I13="",0,1)+IF(K13="",0,1)+IF(M13="",0,1)+IF(O13="",0,1)+IF(Q13="",0,1)+IF(S13="",0,1)+IF(U13="",0,1)+IF(W13="",0,1) -> 8
A14: Troy Steinmetz | B14: St. Xavier B | C14: =G14+I14+K14+M14+O14+Q14+S14+U14+W14 -> 14 | D14: =H14+J14+L14+N14+P14+R14+T14+V14+X14 -> 3 | E14: =IF(Z14=0,0,Y14/Z14) -> 20.833333333333332 | F14: =IF(D14=0,"***",C14/D14) -> 4.666666666666667 | G14: 2 | H14: 0 | I14: 0 | J14: 1 | K14: 1 | L14: 0 | O14: 4 | P14: 2 | Q14: 5 | R14: 0 | U14: 2 | V14: 0 | Y14: =10*C14-5*D14 -> 125 | Z14: =IF(G14="",0,1)+IF(I14="",0,1)+IF(K14="",0,1)+IF(M14="",0,1)+IF(O14="",0,1)+IF(Q14="",0,1)+IF(S14="",0,1)+IF(U14="",0,1)+IF(W14="",0,1) -> 6
A15: Justin Walker | B15: St. Xavier A | C15: =G15+I15+K15+M15+O15+Q15+S15+U15+W15 -> 18 | D15: =H15+J15+L15+N15+P15+R15+T15+V15+X15 -> 7 | E15: =IF(Z15=0,0,Y15/Z15) -> 18.125 | F15: =IF(D15=0,"***",C15/D15) -> 2.5714285714285716 | G15: 2 | H15: 1 | I15: 2 | J15: 2 | M15: 3 | N15: 0 | O15: 1 | P15: 0 | Q15: 2 | R15: 1 | S15: 2 | T15: 1 | U15: 4 | V15: 1 | W15: 2 | X15: 1 | Y15: =10*C15-5*D15 -> 145 | Z15: =IF(G15="",0,1)+IF(I15="",0,1)+IF(K15="",0,1)+IF(M15="",0,1)+IF(O15="",0,1)+IF(Q15="",0,1)+IF(S15="",0,1)+IF(U15="",0,1)+IF(W15="",0,1) -> 8
A16: Nathaniel Guy | B16: Dunbar B | C16: =G16+I16+K16+M16+O16+Q16+S16+U16+W16 -> 17 | D16: =H16+J16+L16+N16+P16+R16+T16+V16+X16 -> 6 | E16: =IF(Z16=0,0,Y16/Z16) -> 17.5 | F16: =IF(D16=0,"***",C16/D16) -> 2.8333333333333335 | G16: 3 | H16: 1 | I16: 4 | J16: 1 | K16: 2 | L16: 1 | M16: 3 | N16: 0 | O16: 1 | P16: 1 | Q16: 2 | R16: 0 | S16: 2 | T16: 1 | W16: 0 | X16: 1 | Y16: =10*C16-5*D16 -> 140 | Z16: =IF(G16="",0,1)+IF(I16="",0,1)+IF(K16="",0,1)+IF(M16="",0,1)+IF(O16="",0,1)+IF(Q16="",0,1)+IF(S16="",0,1)+IF(U16="",0,1)+IF(W16="",0,1) -> 8
A17: Todd Preston | B17: GRC A | C17: =G17+I17+K17+M17+O17+Q17+S17+U17+W17 -> 14 | D17: =H17+J17+L17+N17+P17+R17+T17+V17+X17 -> 1 | E17: =IF(Z17=0,0,Y17/Z17) -> 16.875 | F17: =IF(D17=0,"***",C17/D17) -> 14.00 | G17: 0 | H17: 0 | K17: 2 | L17: 0 | M17: 3 | N17: 0 | O17: 2 | P17: 0 | Q17: 2 | R17: 0 | S17: 3 | T17: 0 | U17: 0 | V17: 1 | W17: 2 | X17: 0 | Y17: =10*C17-5*D17 -> 135 | Z17: =IF(G17="",0,1)+IF(I17="",0,1)+IF(K17="",0,1)+IF(M17="",0,1)+IF(O17="",0,1)+IF(Q17="",0,1)+IF(S17="",0,1)+IF(U17="",0,1)+IF(W17="",0,1) -> 8
A18: Matt Kleinert | B18: Dunbar A | C18: =G18+I18+K18+M18+O18+Q18+S18+U18+W18 -> 15 | D18: =H18+J18+L18+N18+P18+R18+T18+V18+X18 -> 4 | E18: =IF(Z18=0,0,Y18/Z18) -> 16.25 | F18: =IF(D18=0,"***",C18/D18) -> 3.75 | I18: 3 | J18: 0 | K18: 1 | L18: 0 | M18: 1 | N18: 0 | O18: 1 | P18: 1 | Q18: 2 | R18: 0 | S18: 2 | T18: 1 | U18: 4 | V18: 1 | W18: 1 | X18: 1 | Y18: =10*C18-5*D18 -> 130 | Z18: =IF(G18="",0,1)+IF(I18="",0,1)+IF(K18="",0,1)+IF(M18="",0,1)+IF(O18="",0,1)+IF(Q18="",0,1)+IF(S18="",0,1)+IF(U18="",0,1)+IF(W18="",0,1) -> 8
A19: Randy Pike | B19: St. Xavier B | C19: =G19+I19+K19+M19+O19+Q19+S19+U19+W19 -> 11 | D19: =H19+J19+L19+N19+P19+R19+T19+V19+X19 -> 6 | E19: =IF(Z19=0,0,Y19/Z19) -> 16 | F19: =IF(D19=0,"***",C19/D19) -> 1.8333333333333333 | I19: 1 | J19: 2 | K19: 1 | L19: 0 | M19: 2 | N19: 0 | O19: 2 | P19: 2 | W19: 5 | X19: 2 | Y19: =10*C19-5*D19 -> 80 | Z19: =IF(G19="",0,1)+IF(I19="",0,1)+IF(K19="",0,1)+IF(M19="",0,1)+IF(O19="",0,1)+IF(Q19="",0,1)+IF(S19="",0,1)+IF(U19="",0,1)+IF(W19="",0,1) -> 5
A20: Keith Guy | B20: Edmonson B | C20: =G20+I20+K20+M20+O20+Q20+S20+U20+W20 -> 15 | D20: =H20+J20+L20+N20+P20+R20+T20+V20+X20 -> 5 | E20: =IF(Z20=0,0,Y20/Z20) -> 15.625 | F20: =IF(D20=0,"***",C20/D20) -> 3.00 | G20: 4 | H20: 1 | I20: 0 | J20: 0 | K20: 4 | L20: 1 | M20: 2 | N20: 1 | Q20: 1 | R20: 0 | S20: 2 | T20: 1 | U20: 0 | V20: 1 | W20: 2 | X20: 0 | Y20: =10*C20-5*D20 -> 125 | Z20: =IF(G20="",0,1)+IF(I20="",0,1)+IF(K20="",0,1)+IF(M20="",0,1)+IF(O20="",0,1)+IF(Q20="",0,1)+IF(S20="",0,1)+IF(U20="",0,1)+IF(W20="",0,1) -> 8
A21: Spencer Cooke | B21: Edmonson B | C21: =G21+I21+K21+M21+O21+Q21+S21+U21+W21 -> 13 | D21: =H21+J21+L21+N21+P21+R21+T21+V21+X21 -> 1 | E21: =IF(Z21=0,0,Y21/Z21) -> 15.625 | F21: =IF(D21=0,"***",C21/D21) -> 13.00 | G21: 2 | H21: 0 | I21: 1 | J21: 0 | K21: 0 | L21: 1 | M21: 1 | N21: 0 | Q21: 4 | R21: 0 | S21: 3 | T21: 0 | U21: 1 | V21: 0 | W21: 1 | X21: 0 | Y21: =10*C21-5*D21 -> 125 | Z21: =IF(G21="",0,1)+IF(I21="",0,1)+IF(K21="",0,1)+IF(M21="",0,1)+IF(O21="",0,1)+IF(Q21="",0,1)+IF(S21="",0,1)+IF(U21="",0,1)+IF(W21="",0,1) -> 8
A22: Robbyn Pauley | B22: Edmonson A | C22: =G22+I22+K22+M22+O22+Q22+S22+U22+W22 -> 11 | D22: =H22+J22+L22+N22+P22+R22+T22+V22+X22 -> 0 | E22: =IF(Z22=0,0,Y22/Z22) -> 13.75 | F22: =IF(D22=0,"***",C22/D22) -> *** | G22: 0 | H22: 0 | I22: 2 | J22: 0 | K22: 1 | L22: 0 | M22: 1 | N22: 0 | O22: 2 | P22: 0 | Q22: 2 | R22: 0 | S22: 2 | T22: 0 | U22: 1 | V22: 0 | Y22: =10*C22-5*D22 -> 110 | Z22: =IF(G22="",0,1)+IF(I22="",0,1)+IF(K22="",0,1)+IF(M22="",0,1)+IF(O22="",0,1)+IF(Q22="",0,1)+IF(S22="",0,1)+IF(U22="",0,1)+IF(W22="",0,1) -> 8
A23: Brian Hillgetard | B23: St. Xavier B | C23: =G23+I23+K23+M23+O23+Q23+S23+U23+W23 -> 11 | D23: =H23+J23+L23+N23+P23+R23+T23+V23+X23 -> 7 | E23: =IF(Z23=0,0,Y23/Z23) -> 12.5 | F23: =IF(D23=0,"***",C23/D23) -> 1.5714285714285714 | I23: 2 | J23: 1 | K23: 1 | L23: 1 | M23: 1 | N23: 1 | Q23: 1 | R23: 1 | U23: 3 | V23: 2 | W23: 3 | X23: 1 | Y23: =10*C23-5*D23 -> 75 | Z23: =IF(G23="",0,1)+IF(I23="",0,1)+IF(K23="",0,1)+IF(M23="",0,1)+IF(O23="",0,1)+IF(Q23="",0,1)+IF(S23="",0,1)+IF(U23="",0,1)+IF(W23="",0,1) -> 6
A24: David Schoen | B24: St. Xavier A | C24: =G24+I24+K24+M24+O24+Q24+S24+U24+W24 -> 9 | D24: =H24+J24+L24+N24+P24+R24+T24+V24+X24 -> 3 | E24: =IF(Z24=0,0,Y24/Z24) -> 12.5 | F24: =IF(D24=0,"***",C24/D24) -> 3.00 | G24: 3 | H24: 1 | M24: 1 | N24: 1 | O24: 3 | P24: 1 | S24: 0 | T24: 0 | U24: 0 | V24: 0 | W24: 2 | X24: 0 | Y24: =10*C24-5*D24 -> 75 | Z24: =IF(G24="",0,1)+IF(I24="",0,1)+IF(K24="",0,1)+IF(M24="",0,1)+IF(O24="",0,1)+IF(Q24="",0,1)+IF(S24="",0,1)+IF(U24="",0,1)+IF(W24="",0,1) -> 6
A25: Michael Guy | B25: Edmonson B | C25: =G25+I25+K25+M25+O25+Q25+S25+U25+W25 -> 3 | D25: =H25+J25+L25+N25+P25+R25+T25+V25+X25 -> 1 | E25: =IF(Z25=0,0,Y25/Z25) -> 12.5 | F25: =IF(D25=0,"***",C25/D25) -> 3.00 | S25: 2 | T25: 1 | U25: 1 | V25: 0 | Y25: =10*C25-5*D25 -> 25 | Z25: =IF(G25="",0,1)+IF(I25="",0,1)+IF(K25="",0,1)+IF(M25="",0,1)+IF(O25="",0,1)+IF(Q25="",0,1)+IF(S25="",0,1)+IF(U25="",0,1)+IF(W25="",0,1) -> 2
A26: Polly Carden | B26: Apollo | C26: =G26+I26+K26+M26+O26+Q26+S26+U26+W26 -> 10 | D26: =H26+J26+L26+N26+P26+R26+T26+V26+X26 -> 3 | E26: =IF(Z26=0,0,Y26/Z26) -> 12.142857142857142 | F26: =IF(D26=0,"***",C26/D26) -> 3.3333333333333335 | G26: 2 | H26: 0 | K26: 3 | L26: 0 | M26: 3 | N26: 1 | O26: 0 | P26: 1 | S26: 2 | T26: 0 | U26: 0 | V26: 0 | W26: 0 | X26: 1 | Y26: =10*C26-5*D26 -> 85 | Z26: =IF(G26="",0,1)+IF(I26="",0,1)+IF(K26="",0,1)+IF(M26="",0,1)+IF(O26="",0,1)+IF(Q26="",0,1)+IF(S26="",0,1)+IF(U26="",0,1)+IF(W26="",0,1) -> 7
A27: Maraud Gorjian | B27: GRC B | C27: =G27+I27+K27+M27+O27+Q27+S27+U27+W27 -> 10 | D27: =H27+J27+L27+N27+P27+R27+T27+V27+X27 -> 2 | E27: =IF(Z27=0,0,Y27/Z27) -> 11.25 | F27: =IF(D27=0,"***",C27/D27) -> 5.00 | G27: 2 | H27: 0 | I27: 0 | J27: 1 | K27: 1 | L27: 0 | O27: 1 | P27: 0 | Q27: 3 | R27: 0 | S27: 1 | T27: 1 | U27: 0 | V27: 0 | W27: 2 | X27: 0 | Y27: =10*C27-5*D27 -> 90 | Z27: =IF(G27="",0,1)+IF(I27="",0,1)+IF(K27="",0,1)+IF(M27="",0,1)+IF(O27="",0,1)+IF(Q27="",0,1)+IF(S27="",0,1)+IF(U27="",0,1)+IF(W27="",0,1) -> 8
A28: William Baumler | B28: St. Xavier B | C28: =G28+I28+K28+M28+O28+Q28+S28+U28+W28 -> 6 | D28: =H28+J28+L28+N28+P28+R28+T28+V28+X28 -> 1 | E28: =IF(Z28=0,0,Y28/Z28) -> 11 | F28: =IF(D28=0,"***",C28/D28) -> 6.00 | G28: 2 | H28: 0 | K28: 0 | L28: 1 | O28: 2 | P28: 0 | Q28: 2 | R28: 0 | W28: 0 | X28: 0 | Y28: =10*C28-5*D28 -> 55 | Z28: =IF(G28="",0,1)+IF(I28="",0,1)+IF(K28="",0,1)+IF(M28="",0,1)+IF(O28="",0,1)+IF(Q28="",0,1)+IF(S28="",0,1)+IF(U28="",0,1)+IF(W28="",0,1) -> 5
A29: Alicia Still | B29: GRC A | C29: =G29+I29+K29+M29+O29+Q29+S29+U29+W29 -> 9 | D29: =H29+J29+L29+N29+P29+R29+T29+V29+X29 -> 2 | E29: =IF(Z29=0,0,Y29/Z29) -> 10 | F29: =IF(D29=0,"***",C29/D29) -> 4.50 | G29: 1 | H29: 0 | K29: 3 | L29: 0 | M29: 0 | N29: 1 | O29: 1 | P29: 1 | Q29: 0 | R29: 0 | S29: 1 | T29: 0 | U29: 1 | V29: 0 | W29: 2 | X29: 0 | Y29: =10*C29-5*D29 -> 80 | Z29: =IF(G29="",0,1)+IF(I29="",0,1)+IF(K29="",0,1)+IF(M29="",0,1)+IF(O29="",0,1)+IF(Q29="",0,1)+IF(S29="",0,1)+IF(U29="",0,1)+IF(W29="",0,1) -> 8
A30: Peng Lou | B30: Dunbar B | C30: =G30+I30+K30+M30+O30+Q30+S30+U30+W30 -> 10 | D30: =H30+J30+L30+N30+P30+R30+T30+V30+X30 -> 6 | E30: =IF(Z30=0,0,Y30/Z30) -> 8.75 | F30: =IF(D30=0,"***",C30/D30) -> 1.6666666666666667 | G30: 2 | H30: 0 | I30: 3 | J30: 0 | K30: 2 | L30: 0 | M30: 0 | N30: 1 | O30: 0 | P30: 1 | Q30: 2 | R30: 1 | S30: 1 | T30: 1 | W30: 0 | X30: 2 | Y30: =10*C30-5*D30 -> 70 | Z30: =IF(G30="",0,1)+IF(I30="",0,1)+IF(K30="",0,1)+IF(M30="",0,1)+IF(O30="",0,1)+IF(Q30="",0,1)+IF(S30="",0,1)+IF(U30="",0,1)+IF(W30="",0,1) -> 8
A31: Josh Apato | B31: Edmonson A | C31: =G31+I31+K31+M31+O31+Q31+S31+U31+W31 -> 8 | D31: =H31+J31+L31+N31+P31+R31+T31+V31+X31 -> 2 | E31: =IF(Z31=0,0,Y31/Z31) -> 8.75 | F31: =IF(D31=0,"***",C31/D31) -> 4.00 | G31: 2 | H31: 0 | I31: 1 | J31: 0 | K31: 0 | L31: 1 | M31: 2 | N31: 0 | O31: 1 | P31: 0 | Q31: 1 | R31: 0 | S31: 1 | T31: 0 | U31: 0 | V31: 1 | Y31: =10*C31-5*D31 -> 70 | Z31: =IF(G31="",0,1)+IF(I31="",0,1)+IF(K31="",0,1)+IF(M31="",0,1)+IF(O31="",0,1)+IF(Q31="",0,1)+IF(S31="",0,1)+IF(U31="",0,1)+IF(W31="",0,1) -> 8
A32: Sandhya Vondada | B32: Dunbar A | C32: =G32+I32+K32+M32+O32+Q32+S32+U32+W32 -> 8 | D32: =H32+J32+L32+N32+P32+R32+T32+V32+X32 -> 4 | E32: =IF(Z32=0,0,Y32/Z32) -> 7.5 | F32: =IF(D32=0,"***",C32/D32) -> 2.00 | I32: 1 | J32: 1 | K32: 0 | L32: 1 | M32: 0 | N32: 1 | O32: 2 | P32: 0 | Q32: 1 | R32: 0 | S32: 0 | T32: 1 | U32: 3 | V32: 0 | W32: 1 | X32: 0 | Y32: =10*C32-5*D32 -> 60 | Z32: =IF(G32="",0,1)+IF(I32="",0,1)+IF(K32="",0,1)+IF(M32="",0,1)+IF(O32="",0,1)+IF(Q32="",0,1)+IF(S32="",0,1)+IF(U32="",0,1)+IF(W32="",0,1) -> 8
A33: Neil Thornberg | B33: St. Xavier B | C33: =G33+I33+K33+M33+O33+Q33+S33+U33+W33 -> 2 | D33: =H33+J33+L33+N33+P33+R33+T33+V33+X33 -> 0 | E33: =IF(Z33=0,0,Y33/Z33) -> 6.666666666666667 | F33: =IF(D33=0,"***",C33/D33) -> *** | G33: 0 | H33: 0 | M33: 0 | N33: 0 | U33: 2 | V33: 0 | Y33: =10*C33-5*D33 -> 20 | Z33: =IF(G33="",0,1)+IF(I33="",0,1)+IF(K33="",0,1)+IF(M33="",0,1)+IF(O33="",0,1)+IF(Q33="",0,1)+IF(S33="",0,1)+IF(U33="",0,1)+IF(W33="",0,1) -> 3
A34: Matt Prewitt | B34: Edmonson B | C34: =G34+I34+K34+M34+O34+Q34+S34+U34+W34 -> 8 | D34: =H34+J34+L34+N34+P34+R34+T34+V34+X34 -> 8 | E34: =IF(Z34=0,0,Y34/Z34) -> 5.7142857142857144 | F34: =IF(D34=0,"***",C34/D34) -> 1.00 | G34: 1 | H34: 2 | I34: 2 | J34: 1 | K34: 0 | L34: 0 | M34: 2 | N34: 3 | Q34: 0 | R34: 1 | U34: 0 | V34: 1 | W34: 3 | X34: 0 | Y34: =10*C34-5*D34 -> 40 | Z34: =IF(G34="",0,1)+IF(I34="",0,1)+IF(K34="",0,1)+IF(M34="",0,1)+IF(O34="",0,1)+IF(Q34="",0,1)+IF(S34="",0,1)+IF(U34="",0,1)+IF(W34="",0,1) -> 7
A35: Andrew Carter | B35: Apollo | C35: =G35+I35+K35+M35+O35+Q35+S35+U35+W35 -> 4 | D35: =H35+J35+L35+N35+P35+R35+T35+V35+X35 -> 0 | E35: =IF(Z35=0,0,Y35/Z35) -> 5.7142857142857144 | F35: =IF(D35=0,"***",C35/D35) -> *** | G35: 1 | H35: 0 | I35: 2 | J35: 0 | K35: 0 | L35: 0 | M35: 1 | N35: 0 | O35: 0 | P35: 0 | S35: 0 | T35: 0 | U35: 0 | V35: 0 | Y35: =10*C35-5*D35 -> 40 | Z35: =IF(G35="",0,1)+IF(I35="",0,1)+IF(K35="",0,1)+IF(M35="",0,1)+IF(O35="",0,1)+IF(Q35="",0,1)+IF(S35="",0,1)+IF(U35="",0,1)+IF(W35="",0,1) -> 7
A36: Megan Smyth | B36: GRC B | C36: =G36+I36+K36+M36+O36+Q36+S36+U36+W36 -> 5 | D36: =H36+J36+L36+N36+P36+R36+T36+V36+X36 -> 1 | E36: =IF(Z36=0,0,Y36/Z36) -> 5.625 | F36: =IF(D36=0,"***",C36/D36) -> 5.00 | G36: 1 | H36: 0 | I36: 0 | J36: 0 | K36: 0 | L36: 0 | O36: 0 | P36: 0 | Q36: 0 | R36: 1 | S36: 1 | T36: 0 | U36: 1 | V36: 0 | W36: 2 | X36: 0 | Y36: =10*C36-5*D36 -> 45 | Z36: =IF(G36="",0,1)+IF(I36="",0,1)+IF(K36="",0,1)+IF(M36="",0,1)+IF(O36="",0,1)+IF(Q36="",0,1)+IF(S36="",0,1)+IF(U36="",0,1)+IF(W36="",0,1) -> 8
A37: Kevin Puckett | B37: GRC B | C37: =G37+I37+K37+M37+O37+Q37+S37+U37+W37 -> 2 | D37: =H37+J37+L37+N37+P37+R37+T37+V37+X37 -> 0 | E37: =IF(Z37=0,0,Y37/Z37) -> 5 | F37: =IF(D37=0,"***",C37/D37) -> *** | G37: 0 | H37: 0 | K37: 1 | L37: 0 | Q37: 0 | R37: 0 | U37: 1 | V37: 0 | Y37: =10*C37-5*D37 -> 20 | Z37: =IF(G37="",0,1)+IF(I37="",0,1)+IF(K37="",0,1)+IF(M37="",0,1)+IF(O37="",0,1)+IF(Q37="",0,1)+IF(S37="",0,1)+IF(U37="",0,1)+IF(W37="",0,1) -> 4
A38: Joshua Hunn | B38: St. Xavier A | C38: =G38+I38+K38+M38+O38+Q38+S38+U38+W38 -> 1 | D38: =H38+J38+L38+N38+P38+R38+T38+V38+X38 -> 0 | E38: =IF(Z38=0,0,Y38/Z38) -> 5 | F38: =IF(D38=0,"***",C38/D38) -> *** | I38: 0 | J38: 0 | Q38: 1 | R38: 0 | Y38: =10*C38-5*D38 -> 10 | Z38: =IF(G38="",0,1)+IF(I38="",0,1)+IF(K38="",0,1)+IF(M38="",0,1)+IF(O38="",0,1)+IF(Q38="",0,1)+IF(S38="",0,1)+IF(U38="",0,1)+IF(W38="",0,1) -> 2
A39: Michael Reichert | B39: St. Xavier A | C39: =G39+I39+K39+M39+O39+Q39+S39+U39+W39 -> 3 | D39: =H39+J39+L39+N39+P39+R39+T39+V39+X39 -> 2 | E39: =IF(Z39=0,0,Y39/Z39) -> 3.3333333333333335 | F39: =IF(D39=0,"***",C39/D39) -> 1.50 | G39: 1 | H39: 1 | M39: 0 | N39: 0 | O39: 1 | P39: 1 | S39: 0 | T39: 0 | U39: 1 | V39: 0 | W39: 0 | X39: 0 | Y39: =10*C39-5*D39 -> 20 | Z39: =IF(G39="",0,1)+IF(I39="",0,1)+IF(K39="",0,1)+IF(M39="",0,1)+IF(O39="",0,1)+IF(Q39="",0,1)+IF(S39="",0,1)+IF(U39="",0,1)+IF(W39="",0,1) -> 6
A40: James Skees | B40: Edmonson B | C40: =G40+I40+K40+M40+O40+Q40+S40+U40+W40 -> 3 | D40: =H40+J40+L40+N40+P40+R40+T40+V40+X40 -> 2 | E40: =IF(Z40=0,0,Y40/Z40) -> 2.8571428571428572 | F40: =IF(D40=0,"***",C40/D40) -> 1.50 | G40: 1 | H40: 0 | I40: 0 | J40: 0 | K40: 1 | L40: 1 | M40: 0 | N40: 0 | Q40: 1 | R40: 1 | S40: 0 | T40: 0 | W40: 0 | X40: 0 | Y40: =10*C40-5*D40 -> 20 | Z40: =IF(G40="",0,1)+IF(I40="",0,1)+IF(K40="",0,1)+IF(M40="",0,1)+IF(O40="",0,1)+IF(Q40="",0,1)+IF(S40="",0,1)+IF(U40="",0,1)+IF(W40="",0,1) -> 7
A41: Derek Stice | B41: Edmonson A | C41: =G41+I41+K41+M41+O41+Q41+S41+U41+W41 -> 3 | D41: =H41+J41+L41+N41+P41+R41+T41+V41+X41 -> 2 | E41: =IF(Z41=0,0,Y41/Z41) -> 2.5 | F41: =IF(D41=0,"***",C41/D41) -> 1.50 | G41: 0 | H41: 0 | I41: 0 | J41: 2 | K41: 2 | L41: 0 | M41: 0 | N41: 0 | O41: 1 | P41: 0 | Q41: 0 | R41: 0 | S41: 0 | T41: 0 | U41: 0 | V41: 0 | Y41: =10*C41-5*D41 -> 20 | Z41: =IF(G41="",0,1)+IF(I41="",0,1)+IF(K41="",0,1)+IF(M41="",0,1)+IF(O41="",0,1)+IF(Q41="",0,1)+IF(S41="",0,1)+IF(U41="",0,1)+IF(W41="",0,1) -> 8
A42: Aaron Baumer | B42: St. Xavier B | C42: =G42+I42+K42+M42+O42+Q42+S42+U42+W42 -> 1 | D42: =H42+J42+L42+N42+P42+R42+T42+V42+X42 -> 1 | E42: =IF(Z42=0,0,Y42/Z42) -> 1.25 | F42: =IF(D42=0,"***",C42/D42) -> 1.00 | G42: 0 | H42: 0 | M42: 1 | N42: 0 | Q42: 0 | R42: 0 | U42: 0 | V42: 1 | Y42: =10*C42-5*D42 -> 5 | Z42: =IF(G42="",0,1)+IF(I42="",0,1)+IF(K42="",0,1)+IF(M42="",0,1)+IF(O42="",0,1)+IF(Q42="",0,1)+IF(S42="",0,1)+IF(U42="",0,1)+IF(W42="",0,1) -> 4
A43: Sheena Price | B43: Apollo | C43: =G43+I43+K43+M43+O43+Q43+S43+U43+W43 -> 0 | D43: =H43+J43+L43+N43+P43+R43+T43+V43+X43 -> 0 | E43: =IF(Z43=0,0,Y43/Z43) -> 0 | F43: =IF(D43=0,"***",C43/D43) -> *** | I43: 0 | J43: 0 | W43: 0 | X43: 0 | Y43: =10*C43-5*D43 -> 0 | Z43: =IF(G43="",0,1)+IF(I43="",0,1)+IF(K43="",0,1)+IF(M43="",0,1)+IF(O43="",0,1)+IF(Q43="",0,1)+IF(S43="",0,1)+IF(U43="",0,1)+IF(W43="",0,1) -> 2
A44: Randol Hooper | B44: Dunbar B | C44: =G44+I44+K44+M44+O44+Q44+S44+U44+W44 -> 0 | D44: =H44+J44+L44+N44+P44+R44+T44+V44+X44 -> 0 | E44: =IF(Z44=0,0,Y44/Z44) -> 0 | F44: =IF(D44=0,"***",C44/D44) -> *** | Y44: =10*C44-5*D44 -> 0 | Z44: =IF(G44="",0,1)+IF(I44="",0,1)+IF(K44="",0,1)+IF(M44="",0,1)+IF(O44="",0,1)+IF(Q44="",0,1)+IF(S44="",0,1)+IF(U44="",0,1)+IF(W44="",0,1) -> 0
A45: Amy Wang | B45: Dunbar B | C45: =G45+I45+K45+M45+O45+Q45+S45+U45+W45 -> 0 | D45: =H45+J45+L45+N45+P45+R45+T45+V45+X45 -> 0 | E45: =IF(Z45=0,0,Y45/Z45) -> 0 | F45: =IF(D45=0,"***",C45/D45) -> *** | Y45: =10*C45-5*D45 -> 0 | Z45: =IF(G45="",0,1)+IF(I45="",0,1)+IF(K45="",0,1)+IF(M45="",0,1)+IF(O45="",0,1)+IF(Q45="",0,1)+IF(S45="",0,1)+IF(U45="",0,1)+IF(W45="",0,1) -> 0
A46: Amanda Stice | B46: Edmonson A | C46: =G46+I46+K46+M46+O46+Q46+S46+U46+W46 -> 0 | D46: =H46+J46+L46+N46+P46+R46+T46+V46+X46 -> 0 | E46: =IF(Z46=0,0,Y46/Z46) -> 0 | F46: =IF(D46=0,"***",C46/D46) -> *** | Y46: =10*C46-5*D46 -> 0 | Z46: =IF(G46="",0,1)+IF(I46="",0,1)+IF(K46="",0,1)+IF(M46="",0,1)+IF(O46="",0,1)+IF(Q46="",0,1)+IF(S46="",0,1)+IF(U46="",0,1)+IF(W46="",0,1) -> 0
A47: Nicole Mintin | B47: Edmonson A | C47: =G47+I47+K47+M47+O47+Q47+S47+U47+W47 -> 0 | D47: =H47+J47+L47+N47+P47+R47+T47+V47+X47 -> 0 | E47: =IF(Z47=0,0,Y47/Z47) -> 0 | F47: =IF(D47=0,"***",C47/D47) -> *** | Y47: =10*C47-5*D47 -> 0 | Z47: =IF(G47="",0,1)+IF(I47="",0,1)+IF(K47="",0,1)+IF(M47="",0,1)+IF(O47="",0,1)+IF(Q47="",0,1)+IF(S47="",0,1)+IF(U47="",0,1)+IF(W47="",0,1) -> 0
A48: Travis Kuglev | B48: Edmonson B | C48: =G48+I48+K48+M48+O48+Q48+S48+U48+W48 -> 0 | D48: =H48+J48+L48+N48+P48+R48+T48+V48+X48 -> 0 | E48: =IF(Z48=0,0,Y48/Z48) -> 0 | F48: =IF(D48=0,"***",C48/D48) -> *** | Y48: =10*C48-5*D48 -> 0 | Z48: =IF(G48="",0,1)+IF(I48="",0,1)+IF(K48="",0,1)+IF(M48="",0,1)+IF(O48="",0,1)+IF(Q48="",0,1)+IF(S48="",0,1)+IF(U48="",0,1)+IF(W48="",0,1) -> 0
A49: Jennifer Jordan | B49: Edmonson B | C49: =G49+I49+K49+M49+O49+Q49+S49+U49+W49 -> 0 | D49: =H49+J49+L49+N49+P49+R49+T49+V49+X49 -> 0 | E49: =IF(Z49=0,0,Y49/Z49) -> 0 | F49: =IF(D49=0,"***",C49/D49) -> *** | Y49: =10*C49-5*D49 -> 0 | Z49: =IF(G49="",0,1)+IF(I49="",0,1)+IF(K49="",0,1)+IF(M49="",0,1)+IF(O49="",0,1)+IF(Q49="",0,1)+IF(S49="",0,1)+IF(U49="",0,1)+IF(W49="",0,1) -> 0
A50: Ashley Howard | B50: Edmonson B | C50: =G50+I50+K50+M50+O50+Q50+S50+U50+W50 -> 0 | D50: =H50+J50+L50+N50+P50+R50+T50+V50+X50 -> 0 | E50: =IF(Z50=0,0,Y50/Z50) -> 0 | F50: =IF(D50=0,"***",C50/D50) -> *** | Y50: =10*C50-5*D50 -> 0 | Z50: =IF(G50="",0,1)+IF(I50="",0,1)+IF(K50="",0,1)+IF(M50="",0,1)+IF(O50="",0,1)+IF(Q50="",0,1)+IF(S50="",0,1)+IF(U50="",0,1)+IF(W50="",0,1) -> 0
A51: Cody Todd | B51: GRC B | C51: =G51+I51+K51+M51+O51+Q51+S51+U51+W51 -> 0 | D51: =H51+J51+L51+N51+P51+R51+T51+V51+X51 -> 0 | E51: =IF(Z51=0,0,Y51/Z51) -> 0 | F51: =IF(D51=0,"***",C51/D51) -> *** | I51: 0 | J51: 0 | O51: 0 | P51: 0 | S51: 0 | T51: 0 | W51: 0 | X51: 0 | Y51: =10*C51-5*D51 -> 0 | Z51: =IF(G51="",0,1)+IF(I51="",0,1)+IF(K51="",0,1)+IF(M51="",0,1)+IF(O51="",0,1)+IF(Q51="",0,1)+IF(S51="",0,1)+IF(U51="",0,1)+IF(W51="",0,1) -> 4
A52: Hans Mouser | B52: St. Xavier A | C52: =G52+I52+K52+M52+O52+Q52+S52+U52+W52 -> 0 | D52: =H52+J52+L52+N52+P52+R52+T52+V52+X52 -> 0 | E52: =IF(Z52=0,0,Y52/Z52) -> 0 | F52: =IF(D52=0,"***",C52/D52) -> *** | I52: 0 | J52: 0 | Q52: 0 | R52: 0 | Y52: =10*C52-5*D52 -> 0 | Z52: =IF(G52="",0,1)+IF(I52="",0,1)+IF(K52="",0,1)+IF(M52="",0,1)+IF(O52="",0,1)+IF(Q52="",0,1)+IF(S52="",0,1)+IF(U52="",0,1)+IF(W52="",0,1) -> 2
A53: Raemey Reverman | B53: St. Xavier B | C53: =G53+I53+K53+M53+O53+Q53+S53+U53+W53 -> 0 | D53: =H53+J53+L53+N53+P53+R53+T53+V53+X53 -> 0 | E53: =IF(Z53=0,0,Y53/Z53) -> 0 | F53: =IF(D53=0,"***",C53/D53) -> *** | I53: 0 | J53: 0 | O53: 0 | P53: 0 | W53: 0 | X53: 0 | Y53: =10*C53-5*D53 -> 0 | Z53: =IF(G53="",0,1)+IF(I53="",0,1)+IF(K53="",0,1)+IF(M53="",0,1)+IF(O53="",0,1)+IF(Q53="",0,1)+IF(S53="",0,1)+IF(U53="",0,1)+IF(W53="",0,1) -> 3